{
  "$schema": "https://json-schema.org/draft/2020-12/schema",
  "$id": "https://job-radar.local/schemas/source.schema.json",
  "title": "Job Radar Source schema-v3 document",
  "type": "object",
  "additionalProperties": false,
  "required": ["schemaVersion", "key", "name", "status", "sourceConfig", "selectedAccessPath"],
  "properties": {
    "schemaVersion": { "const": 3 },
    "key": { "$ref": "source-behavior/common.schema.json#/$defs/technicalKey" },
    "name": { "$ref": "source-behavior/common.schema.json#/$defs/nonEmptyString" },
    "status": { "$ref": "source-behavior/common.schema.json#/$defs/sourceStatus" },
    "sourceConfig": { "$ref": "source-behavior/common.schema.json#/$defs/jsonObject" },
    "selectedAccessPath": {
      "oneOf": [
        { "$ref": "#/$defs/profileAccessPathSelection" },
        { "$ref": "#/$defs/sourceOwnedAccessPath" }
      ]
    },
    "accessPaths": {
      "type": "array",
      "items": { "$ref": "source-behavior/fragments.schema.json#/$defs/accessPathFragment" }
    },
    "sourceSupport": { "$ref": "source-behavior/common.schema.json#/$defs/supportMetadata" },
    "diagnostics": { "$ref": "source-behavior/diagnostics.schema.json#/$defs/diagnostics" }
  },
  "allOf": [
    {
      "if": {
        "properties": { "selectedAccessPath": { "properties": { "type": { "const": "profile_access_path" } }, "required": ["type"] } },
        "required": ["selectedAccessPath"]
      },
      "then": { "not": { "required": ["sourceSupport"] } }
    },
    {
      "if": {
        "properties": { "selectedAccessPath": { "properties": { "type": { "const": "source_owned_access_path" } }, "required": ["type"] } },
        "required": ["selectedAccessPath"]
      },
      "then": {
        "required": ["sourceSupport"],
        "not": { "required": ["accessPaths"] }
      }
    }
  ],
  "$defs": {
    "profileAccessPathSelection": {
      "type": "object",
      "additionalProperties": false,
      "required": ["type", "profileKey", "pathKey"],
      "properties": {
        "type": { "const": "profile_access_path" },
        "profileKey": { "$ref": "source-behavior/common.schema.json#/$defs/technicalKey" },
        "pathKey": { "$ref": "source-behavior/common.schema.json#/$defs/technicalKey" }
      }
    },
    "sourceOwnedAccessPath": {
      "type": "object",
      "additionalProperties": false,
      "required": ["type", "key", "name", "discovery"],
      "properties": {
        "type": { "const": "source_owned_access_path" },
        "key": { "$ref": "source-behavior/common.schema.json#/$defs/technicalKey" },
        "name": { "$ref": "source-behavior/common.schema.json#/$defs/nonEmptyString" },
        "description": { "$ref": "source-behavior/common.schema.json#/$defs/description" },
        "sourceConfigSchema": { "$ref": "source-behavior/common.schema.json#/$defs/sourceOwnedJsonSchemaObject" },
        "discovery": { "$ref": "source-behavior/policy.schema.json#/$defs/discoveryStrategySet" },
        "detail": { "$ref": "source-behavior/policy.schema.json#/$defs/detailStrategySet" },
        "diagnostics": { "$ref": "source-behavior/diagnostics.schema.json#/$defs/diagnostics" }
      }
    }
  }
}
